"","X","V1","Argumentativ","Claim_Premise","Satz_Nr","Rede_Nr","Sitzungsnummer"
"1",1,"","","","00",38,19119
"2",2,"Die verlieren wir jetzt wieder, Herr Kollege, weil die FDP-Fraktion eine Kurzintervention beantragt hat, die ich zulasse.","","","01",38,19119
"3",3," — Der Kollege Köhler hat das Wort.","","","02",38,19119
"4",4,"Dr.","","","03",38,19119
"5",5," Lukas Köhler:","","","04",38,19119
"6",6,"Lieber Kollege Möring, ich schätze Sie und durchaus auch Ihr Wissen in der Debatte.","","","05",38,19119
"7",7," Sie hatten gerade erwähnt, dass nachrechenbar CO,-Emissionen, die sozusagen im Forstsektor gespeichert werden, nicht langfristig gespeichert werden.","","","06",38,19119
"8",8," Dem widerspricht zum Beispiel die Bundesregierung in der Verordnung zu Land Use, LandUse Change and Forestry, kurz:","","","07",38,19119
"9",9," LULUCF, in der sehr explizit darauf hingewiesen wird, dass eine nachhaltige Holznutzung natürlich langfristig dem CO;-Kreislauf zugutekommt und damit auch als Speicherung agiert und wir so auch zielgenau das Einsetzen unseres Arbil Coins dafür nutzen können, langfristig CO, zu speichern.
 Würden Sie dem widersprechen, und wenn ja, wieso?Vizepräsident Wolfgang ","","","08",38,19119
