"","X","V1","Argumentativ","Claim_Premise","Satz_Nr","Rede_Nr","Sitzungsnummer"
"1",1,"","","","00",82,19079
"2",2,"Möchten Sie eine Nachfrage stellen?Filiz Polat:","","","01",82,19079
"3",3,"Sehr geehrter Herr Präsident! Sehr geehrter Herr Staatssekretär, unabhängig von einer Statistik:","","","02",82,19079
"4",4," Haben die Bundesregierung und das Innenministerium Kenntnis davon, dass Pässe nach wie vor verloren gegangen bzw.","","","03",82,19079
"5",5," nicht auffindbar sind?Marco Wanderwitz, Parl.","","","04",82,19079
"6",6," Staatssekretär beim Bundesminister des Innern, für Bau und Heimat:","","","05",82,19079
"7",7,"Die Einführung von PassTA hatte den Hintergrund, mehr Transparenz über Prüfstatus und Aufbewahrungsort zu generieren.","","","06",82,19079
"8",8," Gleichwohl sind uns keine konkreten Fälle bekannt, die auf irgendeine Art und Weise weiter zu verfolgen oder problematisch sind.
Vizepräsident Thomas ","","","07",82,19079
