"","X","V1","Argumentativ","Claim_Premise","Satz_Nr","Rede_Nr","Sitzungsnummer"
"1",1,"","","","00",86,19073
"2",2," Sind Sie damit zufrieden, Frau Hänsel?Heike Hänsel:","","","01",86,19073
"3",3,"Nein, ich würde gerne nachfragen.","","","02",86,19073
"4",4," Bisher waren die Antworten eigentlich keine Antworten, auch auf die vorherigen Fragen nicht.","","","03",86,19073
"5",5,"Ich möchte dieses Thema noch einmal auf die Tagesordnung bringen; denn Julian Assange ist als politischer Flüchtling von der ecuadorianischen Regierung anerkannt und befindet sich seit über sechs Jahren in dieser Botschaft.","","","04",86,19073
"6",6," Das Ganze hat eine internationale Dimension:","","","05",86,19073
"7",7," Er hat unter anderem US-Kriegsverbrechen im Irak und in Afghanistan aufgedeckt und musste sich deshalb in die Botschaft begeben, weil die USA versucht haben, ihn strafrechtlich zu verfolgen, und zwar auf europäischem Boden.","","","06",86,19073
"8",8," Da stellt sich mir schon die Frage, ob die Bundesregierung bereit ist, eine derartige extraterritoriale Verfolgung vonseiten der USA von Whistleblowern und Journalisten auf europäischem Boden einfach hinzunehmen und zu sagen:","","","07",86,19073
"9",9," Das betrifft uns nicht; das betrifft nur Ecuador und Großbritannien.
 — Muss nicht im Rahmen der EU eine Initiative ergriffen werden, um Whistleblower vor einer solchen extraterritorialen Verfolgung zu schützen?Vizepräsident Thomas ","","","08",86,19073
