"","X","V1","Argumentativ","Claim_Premise","Satz_Nr","Rede_Nr","Sitzungsnummer"
"1",1,"","","","00",95,19091
"2",2,"Eine weitere Nachfrage, Herr Brandner.","","","01",95,19091
"3",3,"Stephan Brandner:","","","02",95,19091
"4",4,"Gut, dann frage ich in diesem Zusammenhang anders.","","","03",95,19091
"5",5," Es steht die mutmaßliche Aussage des Herrn Maas im Raum, es gebe keine einzige nachweisbare Verbindung zwischen dem Terrorismus und den Flüchtlingen.
 Ist diese Aussage — unabhängig davon, wer sie gemacht hat -, dass es keine Verbindung zwischen Terrorismus und Flüchtlingen gibt, eine Aussage, die die Bundesregierung machen würde? Oder ist es eine Aussage, die die Bundesregierung damals so vertreten hat und heute nicht mehr? Oder ist es eine Aussage, die die Bundesregierung nie treffen würde? Vizepräsident Thomas ","","","04",95,19091
