"","X","V1","Argumentativ","Claim_Premise","Satz_Nr","Rede_Nr","Sitzungsnummer"
"1",1,"","","","00",100,19097
"2",2," Frau Kluckert.","","","01",100,19097
"3",3,"Daniela Kluckert:","","","02",100,19097
"4",4,"Das sehen wir auch so.","","","03",100,19097
"5",5," Es ist schon mal gut, dass wir darüber Konsens hergestellt haben.","","","04",100,19097
"6",6," Jetzt bleibt natürlich noch die Frage, wie wir das umsetzen.","","","05",100,19097
"7",7," In der Verordnung, die das Verkehrsministerium vorgelegt hat, ist die Rede davon, dass man auf jeden Fall eine Versicherungspflicht braucht.","","","06",100,19097
"8",8," Das würde für Jugendliche unter 18 Jahren bedeuten, dass sie dafür 90 Euro im Jahr aufwenden müssten.","","","07",100,19097
"9",9," Sie kennen ja die Situation von Jugendlichen, die sich in der Schule oder in der Ausbildung befinden und sehr niedrige finanzielle Möglichkeiten besitzen.
 Wie schätzen Sie mit Blick auf die 90 Euro die finanziellen Möglichkeiten der Jugendlichen ein? Vizepräsidentin Claudia ","","","08",100,19097
