"","X","V1","Argumentativ","Claim_Premise","Satz_Nr","Rede_Nr","Sitzungsnummer"
"1",1,"","","","00",154,19127
"2",2,"Drei weitere Redner haben ihre Reden zu Protokoll gegeben.","","","01",154,19127
"3",3,"!) - Bevor ich die Rednerliste schließe, hat der Kollege Frank Heinrich für die Fraktion der CDU/CSU das Wort.","","","02",154,19127
"4",4," Frank Heinrich:","","","03",154,19127
"5",5,"Sehr geehrter Herr Präsident! Auch wenn ich nicht Fan davon bin, um diese Uhrzeit zu reden:","","","04",154,19127
"6",6," Das wollte ich in dieser Debatte doch nicht als letztes Wort hier stehen lassen.","","","05",154,19127
"7",7," Sehr geehrte Kollegen und Kolleginnen! Sehr geehrte Herren! Kinderrechte sind Menschenrechte — Herr Kollege Braun, an der Stelle sind Sie übrigens gar nicht aufden Antrag eingegangen, sondern nur auf eine Zeile, die in dem Antrag der Grünen steht —,D Anlage 14sie gelten immer und überall und für jedes Kind, und alle Kinder haben die gleichen Rechte auf Schutz und Fürsorge, eine Identität sowie ein Recht auf Bildung.","","","06",154,19127
"8",8," Sie haben das Recht, ein erfülltes und angemessenes Leben zu führen.","","","07",154,19127
"9",9,"In Deutschland ist es selbstverständlich, dass Kinder zur Schule gehen.","","","08",154,19127
"10",10," In vielen Ländern dieser Welt haben sie oft keine Möglichkeit dazu, weil sie unter anderem tagein, tagaus arbeiten müssen.","","","09",154,19127
"11",11," In diesem Zusammenhang wünsche ich mir, dass wir über unsere Grenze gucken.","","","10",154,19127
"12",12,"Ich denke an den Friedensnobelpreisträger Dr.","","","11",154,19127
"13",13," Mukwege aus dem Kongo und daran, dass seine Kinder und Enkelkinder die gleichen Chancen bekommen sollen wie meine Kinder und Enkelkinder.","","","12",154,19127
"14",14," Und auch die Kinder und Enkelkinder der Frauen, die er als Doktor wegen der Kriegszustände in seinem Land zusammenflicken muss, wofür er eben den Friedensnobelpreis bekommen hat, sollen die gleichen Chancen erhalten!Ich kann mich erinnern, dass ich in dieser Region — im Kongo — war und bei einem Gesprach ein Kind mit starren Augen auf dem Schoß einer Frau gesehen habe, die sich später als Tante dieses jungen Kindes herausstellte.","","","13",154,19127
"15",15," Ich habe 20 Minuten lang versucht - ich habe vier Kinder und drei Enkel und liebe das Umfeld —, dem Kind eine Gefühlsregung abzuringen.","","","14",154,19127
"16",16," Es war nicht möglich.","","","15",154,19127
"17",17,"Das Mädchen war traumatisiert, unter anderem deswegen, wie ich später hörte, weil sie mit ihrer Mutter angeschossen wurde.","","","16",154,19127
"18",18," Die Mutter starb und wurde zusammen mit dem Kind, weil man es auch für tot hielt, und mit mehreren anderen Menschen in ein Grab geschmissen.","","","17",154,19127
"19",19," Die Oma hat sie dann unter den anderen Toten wieder herausgeholt.","","","18",154,19127
"20",20," Traumatisiert! Nicht die gleichen Rechte wie wir!Ich danke den Grünen, dass sie diesen Antrag eingebracht und sich Mühe gemacht haben, und ich danke für viele der Forderungen, die in diesem Antrag stehen.","","","19",154,19127
"21",21," Er passt sehr gut zu dem Antrag mit dem Titel „Kinder weltweit schützen — Ausbeuterische Kinderarbeit verhindern“, den wir als Koalition vor, ich glaube, drei Stunden hier eingebracht haben.","","","20",154,19127
"22",22,"Wenn sich der Beschluss der UN-Kinderrechtskonvention nächste Woche zum 30.","","","21",154,19127
"23",23," Mal jährt, dann ist es gut, einen Blick zurück, einen Blick in die Gegenwart und einen Blick in die Zukunft zu werfen.","","","22",154,19127
"24",24," Dabei sollten wir vielleicht auch über unsere Grenzen hinausschauen, was ich gerade sehr vermisst habe.","","","23",154,19127
"25",25,"Der Blick in die Vergangenheit ist schon sehr schwierig.","","","24",154,19127
"26",26," Da gibt es nicht nur dieses Bild von traumatisierten Kindern.","","","25",154,19127
"27",27," Manchmal wirkt der Blick in die Gegenwart schon sehr deprimierend, trotzdem hat sich in den letzten 30 Jahren eine Menge getan:","","","26",154,19127
"28",28," Die Sklaverei und Ausbeutung — auch unter Kindern; teilweise sogar bis in europäische Länder hinein — waren weitaus stärker verbreitet als heute.","","","27",154,19127
"29",29," Die Selbstverständlichkeit, eine Schule zu besuchen, war damals absolut nicht gegeben — ganz besonders für Mädchen nicht.","","","28",154,19127
"30",30," Und beim Thema Gesundheit? Der Prozentsatz der Menschen, die Zugang zur Gesundheits rank Heinrich versorgung haben, hat sich vervielfacht.","","","29",154,19127
"31",31," Die Kindersterblichkeit war riesig und ist jetzt selbst in sehr schwachen Ländern viel geringer.","","","30",154,19127
"32",32,"Aber selbst wenn man jetzt in die Gegenwart guckt, muss man vorsichtig sein, dass man nicht noch eine Menge an Frust kassiert.","","","31",154,19127
"33",33," Nach Schätzungen der Internationalen Arbeitsorganisation müssen zurzeit weltweit immer noch 152 Millionen Kinder arbeiten, 73 Millionen davon unter ausbeuterischen Umständen — in Subsahara-A frika jedes dritte Kind im Alter zwischen 5 und 14 Jahren.","","","32",154,19127
"34",34,"Die Arbeit ist sehr unterschiedlich.","","","33",154,19127
"35",35," Es ist gibt Kinder — wie in der Region, von der ich gerade sprach, im Kongo -, die in die Bergwerke und Minen gehen müssen, die aus Sparsamkeitsgründen eben einfach für kleinere Menschen gebaut sind, um dort Coltan oder Lithium herauszuholen, die sich in manchen unserer Geräte befinden, sodass wir uns diese Dinge hier vielleicht billiger besorgen können.","","","34",154,19127
"36",36," Es können auch Arbeiten im Haushalt oder Reinigungsarbeiten sein, es kann die Betreuung kleiner Kinder oder eine Arbeit bei der Produktion von Textilien, Schuhen oder Teppichen oder eine Arbeit in Minen sein.","","","35",154,19127
"37",37," Die Zahlen hat der Kollege Gehring gerade genannt:","","","36",154,19127
"38",38," 385 Millionen Kinder leben in extremer Armut, 36 Millionen Kinder können keine Schule besuchen.","","","37",154,19127
"39",39,"Um Kinderarbeit wirksam zu verhindern, müssen Armut bekämpft, existenzsichernde Löhne für Erwachsene gezahlt sowie ein verbesserter Bildungszugang erreicht werden.","","","38",154,19127
"40",40," Natürlich tragen auch die steigende Anzahl an Fluchtgründen und die irreguläre Migration dazu bei, die Gefahr der Ausbeutung von Kindern zu erhöhen.","","","39",154,19127
"41",41," Das UNHCR sagte letztes Jahr im Juni, dass sich 36 Millionen Kinder auf der Flucht befinden.","","","40",154,19127
"42",42,"Dann habe ich wieder Achmed vor mir, der schon mehrere Monate in einem Flüchtlingslager in Jordanien leben muss, weil er aus Syrien, aus einem Kriegsgebiet, vertrieben wurde.","","","41",154,19127
"43",43," Er ist 15 oder 16 Jahre alt, und bei dem Gedanken, dass die da drüben sein Haus und seine Kindergartenfreunde zerschießen, sagte er in unserer Runde:","","","42",154,19127
"44",44," Ich brauche auch ein Gewehr; ich will sofort da rüber.","","","43",154,19127
"45",45," — Was mich am meisten geschockt hat, war, dass seine Mutter keinen Einspruch erhoben hat.","","","44",154,19127
"46",46,"Das geht bis in unseren Alltag hinein.","","","45",154,19127
"47",47," Wir haben heute eine Veranstaltung zum Grünen Knopf gehabt.","","","46",154,19127
"48",48," Das ist das, was von uns in der Politik als Reaktion kommen muss! Ich bin dankbar für das Heute.","","","47",154,19127
"49",49," Der Grüne Knopf besagt ausdrücklich, dass Kinderarbeit bei der Verarbeitung von Textilien ausgeschlossen werden muss.","","","48",154,19127
"50",50," Und ja:","","","49",154,19127
"51",51," Im Hinblick auf den Aktionsplan „Agents of Change“ — so nennen Sie ihn auch in Ihrem Antrag — können wir darüber nachdenken, das Monitoring zu verbessern.","","","50",154,19127
"52",52," Das BMZ möchte dabei der besonderen Rolle von Kindern und Jugendlichen Rechnung tragen.","","","51",154,19127
"53",53," Kinder sind wichtige Akteure beim Wandel.","","","52",154,19127
"54",54,"Bei der Unterstützung für das Forum Nachhaltiger Kakao e.","","","53",154,19127
"55",55," V.","","","54",154,19127
"56",56," geht es um die Verbesserung der Einkommenssituation in diesem Sektor.","","","55",154,19127
"57",57,"Das kann man Sektor für Sektor, Branche für Branche machen.","","","56",154,19127
"58",58," Da sind wir allerdings auf alle, nicht nur auf die Politik, sondern auch auf die Wirtschaft und auf den Konsumenten, angewiesen, Agents of Change zu sein.","","","57",154,19127
"59",59," Und dann ist dieser Tage von einem unserer großen Discounter — einer derer, die den Nachhaltigkeitsfaktor verkörpern müssen —, zu hören:","","","58",154,19127
"60",60," „Dann erhören wir die Jugendlichen von Fridays for Future, und dann verändern wir unsere Sortimente‘ — und es verändert sich im Regal noch nichts, kaum bemerkbar.","","","59",154,19127
"61",61,"Auch wenn die Grünen als Antragsteller das anders deuten werden:","","","60",154,19127
"62",62," Ich glaube, die Bundesregierung hat einiges aufgesetzt.","","","61",154,19127
"63",63," Ein Blick in die Zukunft zeigt:","","","62",154,19127
"64",64," Wir sind leider noch nicht am Ziel.","","","63",154,19127
"65",65," Bei der Feststellung der Zielrichtung und der Größe der Herausforderung sind wir mit Ihnen vollkommen einig.","","","64",154,19127
"66",66," Ich wünsche mir aber, dass wir noch besser hingucken, zum Beispiel wenn Organisationen für Hauttransplantationen bei uns auf Kinder in Nepal zurückgreifen oder wenn Straftaten in sozialen Netzwerken - für Dienstleistungen, die bei uns von der Couch aus in Anspruch genommen werden — an Kindern auf den Philippinen vollbracht werden, verbrochen werden.","","","65",154,19127
"67",67," Ich wünsche mir, dass wir das unterbinden, :","","","66",154,19127
"68",68," Nochmals danke fürs Einbringen.
 Lassen Sie uns gemeinsam an dieser Herkulesaufgabe arbeiten! Vizepräsident Thomas ","","","67",154,19127
