"","X","V1","Argumentativ","Claim_Premise","Satz_Nr","Rede_Nr","Sitzungsnummer"
"1",1,"","","","00",3,19138
"2",2," Guten Morgen, verehrte Kolleginnen und Kollegen! Bitte nehmen Sie Platz.","","","01",3,19138
"3",3," Die Sitzung ist eröffnet.","","","02",3,19138
"4",4,"Nach dem Tagesordnungspunkt 25 soll auf Verlangen der Fraktion der AfD eine Aktuelle Stunde mit dem Titel „Das Globale Flüchtlingsforum in Genf und ein Grundrechtekatalog für Menschen mit afrikanischer Abstammung“ stattfinden.","","","03",3,19138
"5",5," Sind Sie damit einverstanden? — Dann ist das so beschlossen.","","","04",3,19138
"6",6,"Ich rufe den Tagesordnungspunkt 21 auf:","","","05",3,19138
"7",7," Vereinbarte DebatteZwischenbilanz der Enquete-Kommission „Künstliche Intelligenz — Gesellschaftliche Verantwortung und wirtschaftliche, soziale und ökologische Potenziale“Für die Aussprache wurde eine Dauer von 60 Minuten beschlossen.","","","06",3,19138
"8",8,"Ich eröffne die Aussprache und erteile das Wort dem Kollegen Rene Röspel, SPD.","","","07",3,19138
"9",9," Rene Röspel:","","","08",3,19138
"10",10," Einen schönen guten Morgen! Ich bin etwas überrascht über die Reihenfolge.","","","09",3,19138
"11",11,"Herr Präsident! Meine sehr verehrten Damen und Herren! Das Parlament ist, glaube ich, noch ein bisschen müde.","","","10",3,19138
"12",12," Wir waren gestern Abend lange hier.","","","11",3,19138
"13",13," Man könnte sich wünschen, dass die eine oder andere Weihnachtsfeier vielleicht durch künstliche Intelligenz ersetzt werden könnte.","","","12",3,19138
"14",14," Das würde der Gesundheit nicht abträglich sein.","","","13",3,19138
"15",15,"Woran, liebe Zuschauerinnen und Zuschauer, denken Sie, wenn Sie an künstliche Intelligenz denken? Vielleicht denken Sie an das autonome Fahren, daran, dass in einigen Jahren vielleicht etwas möglich sein wird, auch wenn es jetztnoch kompliziert ist, nämlich dass, wenn Sie die App drücken und sagen, Sie möchten in fünf Minuten von A nach B gebracht werden, ein Auto kommt und Sie9.","","","14",3,19138
"16",16,"00 Uhrmit Elektromobilität umweltfreundlich ans Ziel bringt, Sie keinen Parkplatz zu suchen brauchen und auch wieder abgeholt werden? Denken Sie bei künstlicher Intelligenz vielleicht an den Roboter, der Ihre Oma pflegen wird, so wie das in Japan in Teilen schon der Fall ist? Oder denken Sie an den Roboter, der Sie am Knie mit hoher Präzision operieren wird?Künstliche Intelligenz kommt nicht erst; sie ist schon da, sie durchdringt unsere Gesellschaft bereits.","","","15",3,19138
"17",17," Es liegt tatsächlich an uns, ob wir die Chancen oder die Risiken überwiegen lassen und wie wir künstliche Intelligenz gestalten.","","","16",3,19138
"18",18," Wir können wählen zwischen den Systemen, die es schon gibt.","","","17",3,19138
"19",19," Künstliche Intelligenz dient in China dem Staat dazu, die Bürger zu überwachen; in den USA dagegen ist alles sehr unreglementiert.","","","18",3,19138
"20",20," Ich glaube aber, dass hier Einigkeit besteht, dass wir ein europäisches, ein deutsches Modell von künstlicher Intelligenz haben:","","","19",3,19138
"21",21," Künstliche Intelligenz soll den Menschen dienen, darf sie aber nicht überwachen und soll insgesamt einen gesellschaftlichen Fortschritt bewirken, der vernünftig ist.","","","20",3,19138
"22",22," Wir reden heute das erste Mal über die erste Phase der Arbeit der Enquete-Kommission „Künstliche Intelligenz“.","","","21",3,19138
"23",23," Wir haben sie der Arbeit wegen in zwei Phasen aufgeteilt.","","","22",3,19138
"24",24," Unter anderem waren in der ersten Phase Wirtschaft, Staat und Gesundheit Thema.","","","23",3,19138
"25",25," Ich bin sehr davon überzeugt, dass im Bereich Gesundheit künstliche Intelligenz das Leben in vielen Bereichen viel besser machen wird, nämlich da, wo es gelingt, Diagnosen schneller zu ermitteln und Therapien schneller zur Verfügung zu stellen und zielgenauer zu arbeiten.","","","24",3,19138
"26",26," Das geht am besten übrigens — das ist eine unserer Erkenntnisse — immer mit Menschen zusammen.","","","25",3,19138
"27",27," Die Interaktion von Mensch und Maschine ist wichtig, wird zum Erfolg führen und wird dazu beitragen, dass Menschen besser gepflegt und gesund erhalten werden können.","","","26",3,19138
"28",28,"Aber:","","","27",3,19138
"29",29," Für künstliche Intelligenz braucht es unglaublich viele Daten, die gesammelt werden müssen.","","","28",3,19138
"30",30," Gerade im Gesundheitsbereich sind Daten hochsensibel und sehr persönlich.","","","29",3,19138
"31",31," Deswegen sind wir sehr der Auffassung, dass René Réspelbei der Freigabe von Daten und die Verwendung von Daten der betroffene Patient, der Mensch mitentscheiden muss und sogar widersprechen können sollte und dass mit den Daten sehr transparent und kontrolliert umgegangen und kein Missbrauch betrieben wird.","","","30",3,19138
"32",32,"Im Bereich der Pflege wie im Gesundheitsbereich insgesamt kann künstliche Intelligenz das Leben besser machen.","","","31",3,19138
"33",33," Aber wir sind ausdrücklich der Auffassung, dass künstliche Intelligenz nicht menschliche Nähe und Zuwendung ersetzen darf, sondern sie muss die Freiräume schaffen, die es braucht, damit Pflege weiterhin menschlich bleibt.","","","32",3,19138
"34",34," Das ist Zielsetzung künstlicher Intelligenz.","","","33",3,19138
"35",35," Die häufigsten Ängste und Sorgen, die ich jedenfalls höre, wenn ich mit anderen Menschen darüber diskutiere, was für sie künstliche Intelligenz ist, betreffen tatsächlich den Arbeitsplatz.","","","34",3,19138
"36",36," Wird künstliche Intelligenz meinen Arbeitsplatz ersetzen? Wird künstliche Intelligenz zukünftig mich ersetzen? Wird künstliche Intelligenz vielleicht sogar über mich bestimmen oder mir sagen, wie ich mich verhalten soll? Tatsächlich wird künstliche Intelligenz im Bereich der Arbeit die Welt verändern.","","","35",3,19138
"37",37," Viele Tausende Jobs, Hunderttausende Jobs werden wegfallen, neue werden entstehen.","","","36",3,19138
"38",38," Wir werden in der Enquete-Kommission noch darüber diskutieren, wie die Bilanz aussehen wird.","","","37",3,19138
"39",39," Ich glaube, dass sie positiv sein wird, also dass mehr Arbeitsplätze entstehen werden als wegfallen.","","","38",3,19138
"40",40,"Aber wir haben dabei einige Dinge zu beachten.","","","39",3,19138
"41",41," Was bedeutet das für den einzelnen Arbeitnehmer, für die einzelne Arbeitnehmerin? Wird er oder sie den Wechsel schaffen? Wird er oder sie überfordert sein von neuen Anwendungen, von neuen Jobs? Deswegen ist es richtig, dass wir zusehen, dass Menschen schon heute qualifiziert, ausgebildet und vorbereitet werden auf neue Anforderungen, die über künstliche Intelligenz an sie herangetragen werden.","","","40",3,19138
"42",42," Deswegen bin ich sehr froh, dass von Hubertus Heil als Arbeitsminister mit dem Qualifizierungschancengesetz der Großen Koalition der erste Schritt gemacht wird, Menschen bereits im Job zu qualifizieren, damit sie den nächsten Job bewältigen können.","","","41",3,19138
"43",43," Die wichtige Frage wird auch sein:","","","42",3,19138
"44",44," Werden die Arbeitnehmerrechte, die Sozialsysteme, die wir jetzt haben, die darauf zugeschnitten sind, dass ein Mensch in einem Betrieb arbeitet, dort angestellt ist, Arbeitnehmer ist, eigentlich noch passen bei den Herausforderungen, bei den Anforderungen der künstlichen Intelligenz? Es wird noch eine spannende Diskussion werden:","","","43",3,19138
"45",45," Was bedeutet künstliche Intelligenz für Mitbestimmung, für Arbeitnehmerrechte und für das Sozialversicherungssystem, und wie gelingt es, dass trotzdem eine solidarische Krankenversicherung und Rentenversicherung bezahlt werden wird?Wir als SPD sehen künstliche Intelligenz als Teil des Fortschritts.","","","44",3,19138
"46",46," Aber Fortschritt ist kein Selbstzweck.","","","45",3,19138
"47",47," Wir wollen, dass aus technologischem Fortschritt gesellschaftlicher und sozialer Fortschritt wird.","","","46",3,19138
"48",48," — Ich bedanke mich für die Aufmerksamkeit.","","","47",3,19138
"49",49," Ich danke ausdrücklich unseren Mitarbeitern für die tolle Arbeit.","","","48",3,19138
"50",50," Ich habe gesehen, dass die Mitarbeiter des Sekretariats der Enquete-Kommission auf der Zuschauertribüne sind.","","","49",3,19138
"51",51," Sie haben das Jahr mit viel Arbeit toll gemeistert.","","","50",3,19138
"52",52," Ihnen dafür herzlichen Dank von dieser Seite aus! Präsident Dr.
 Wolfgang ","","","51",3,19138
