"","X","V1","Argumentativ","Claim_Premise","Satz_Nr","Rede_Nr","Sitzungsnummer"
"1",1,"","","","00",64,19137
"2",2," Herr Kollege, kommen Sie bitte zum Schluss.","","","01",64,19137
"3",3,"Andreas Jung:","","","02",64,19137
"4",4,"Das ist die eine Grundlage.
 Die andere Grundlage ist, dass wir die zusätzlichen Einnahmen, die dadurch in den Haushalt fließen, den Bürgern in vollem Umfang dadurch zurückgeben, dass wir Stromkosten senken, dass wir Pendler besser unterstützen, —Vizepräsident Wolfgang ","","","03",64,19137
