"","X","V1","Argumentativ","Claim_Premise","Satz_Nr","Rede_Nr","Sitzungsnummer"
"1",1,"","","","00",50,19099
"2",2," Für die SPD-Fraktion hat das Wort der Kollege Ralf Kapschack.","","","01",50,19099
"3",3," Ralf Kapschack:","","","02",50,19099
"4",4,"Herr Präsident! Liebe Kolleginnen und Kollegen! Verehrte Zuschauer! Ich würde gerne wieder zur Sache reden; denn ich glaube, Pöbeleien helfen bei diesem Thema nicht weiter.","","","03",50,19099
"5",5," Ralf KapschackWir feiern in diesem Jahr den 30.","","","04",50,19099
"6",6," Jahrestag des Mauerfalls.","","","05",50,19099
"7",7," Ohne die Fantasie, den Mut und die Durchsetzungskraft vieler Frauen und Manner in der DDR ware das nicht möglich gewesen.","","","06",50,19099
"8",8," Ich glaube, das kann man nicht oft genug sagen.","","","07",50,19099
"9",9," Es war für viele eine dramatische Veränderung in ihrem Leben.","","","08",50,19099
"10",10," Vieles hat sich für sie zum Besseren gewendet, aber es ist auch Sicherheit verloren gegangen.","","","09",50,19099
"11",11," Wir sollten uns in Erinnerung rufen — das ist schon angesprochen worden -, dass es mit der Wiedervereinigung gewaltige Umwälzungen gegeben hat, die in kürzester Zeit stattgefunden haben.","","","10",50,19099
"12",12," Es war eine enorme Leistung, wie schnell und im Grunde auch effektiv eine Überleitung in die bundesdeutschen Sozialsysteme funktioniert hat, sicherlich mit Kompromissen aufbeiden Seiten und nicht immer mit einem für alle befriedigenden Ergebnis.","","","11",50,19099
"13",13," Deshalb ist klar — darüber reden wir ja heute —, dass es Härten und persönlich empfundene Ungerechtigkeiten bei der Rentenüberleitung von dem System der DDR in das Rentensystem der Bundesrepublik gab.","","","12",50,19099
"14",14," Trotzdem muss man sagen — Kollege Rehberg hat darauf hingewiesen -, dass in den neuen Bundesländern die gezahlten Renten im Schnitt höher sind als im Westen.","","","13",50,19099
"15",15," Das hat nicht zuletzt etwas mit der Erwerbsbeteiligung von Frauen vor der Wende zu tun.","","","14",50,19099
"16",16," Klar ist:","","","15",50,19099
"17",17," Das sind Durchschnittszahlen.","","","16",50,19099
"18",18," Eine ganze Reihe von Frauen und Männern bezieht allerdings trotz Arbeit und geleisteter Beiträge Grundsicherung im Alter oder liegt deutlich hinter den gezahlten Renten in Westdeutschland zurück — bei gleicher Berufsbiografie.","","","17",50,19099
"19",19," Menschlich ist es sehr gut nachvollziehbar, dass Rentnerinnen und Rentner für Sonderregelungen, Angleichungen streiten, so wie es auch in den diskutierten Anträgen und Beschlussempfehlungen deutlich wird.","","","18",50,19099
"20",20,"Ich bin Mitglied des Petitionsausschusses.","","","19",50,19099
"21",21," Wir bekommen regelmäßig Petitionen von Frauen und Männern, die die Konsequenzen der Rentenüberleitung von Ost nach West für sich persönlich sehr nachvollziehbar für ungerecht halten.","","","20",50,19099
"22",22," Ob es die eben angesprochene Problematik des Versorgungsausgleichs ist oder zum Beispiel die Überführung der Rentenansprüche ehemaliger Beschäftigter der DDR-Post in die gesetzliche Rentenversicherung oder die Berücksichtigung von Zeiten im Zusatzversorgungssystem der technischen Intelligenz:","","","21",50,19099
"23",23," An diesen Beispielen wird schon deutlich, wie unterschiedlich die Alterssicherung in der DDR im Vergleich zur Bundesrepublik war.","","","22",50,19099
"24",24," Es ist eine Illusion, zu glauben, man könne hier Entscheidungen, die vor fast 30 Jahren getroffen worden sind, für alle Gruppen rückgängig machen, die sich ungerecht behandelt fühlen.","","","23",50,19099
"25",25," Es ist schwer vermittelbar, dass Leistungen aus einem System, das es in dieser Form nicht mehr gibt, aufrechterhalten werden sollen.","","","24",50,19099
"26",26," Es ist angesprochen worden, und wir meinen es ernst:","","","25",50,19099
"27",27," Wir wollen den im Koalitionsvertrag vereinbarten Fonds einrichten, der Härtefälle im Zuge der Rentenüberleitung abmildern soll.","","","26",50,19099
"28",28," Aber natürlich müssen wir trotzdem gucken, wie wir die Situation grundsätzlich verbessern können.","","","27",50,19099
"29",29," Und wir haben einiges gemacht in der Rentenpolitik; darüber haben wir hier teilweise ja auch sehr intensiv und sehr kontrovers diskutiert.","","","28",50,19099
"30",30," Mit der Rentenangleichung Ost-West, die bereits beschlossen ist, sind wir auf dem richtigen Weg.","","","29",50,19099
"31",31," Auch in den ostdeutschen Bundesländern wird die Grundrente für höhere Renten sorgen.","","","30",50,19099
"32",32," Wir stabilisieren das Rentenniveau und den Beitragssatz.","","","31",50,19099
"33",33," Wir haben Verbesserungen bei der Mütterrente und den Erwerbsminderungsrenten auf die Schiene gesetzt.","","","32",50,19099
"34",34," Das kommt allen zugute, in West wie in Ost.","","","33",50,19099
"35",35," Klar ist natürlich:","","","34",50,19099
"36",36," Die im Vergleich zum Westen oft immer noch niedrigeren Löhne, die geringe Tarifbindung von Unternehmen hinterlassen Spuren.","","","35",50,19099
"37",37," Nicht alles, was im Erwerbsleben schiefgelaufen ist, lässt sich mit der Rente reparieren.","","","36",50,19099
"38",38," Und dennoch — darüber wird aktuell zu Recht sehr viel diskutiert — können wir nicht sagen:","","","37",50,19099
"39",39," Ihr habt einfach Pech gehabt.","","","38",50,19099
"40",40,"Die Grundrente, wie sie Hubertus Heil vorgeschlagen hat, ist ein geeignetes Instrument, um die Renten derjenigen aufzuwerten, die jahrzehntelang gearbeitet, aber unterdurchschnittlich verdient haben.","","","39",50,19099
"41",41," Das ist Anerkennung von Lebensleistung, auch in diesem Zusammenhang, und kein Almosen.","","","40",50,19099
"42",42," Wer viele Jahre gearbeitet, Kinder erzogen und/oder Angehörige gepflegt hat, der soll im Alter bei niedrigen Renten bessergestellt werden als bisher.","","","41",50,19099
"43",43," Davon würden nicht zuletzt Frauen und Männer in den ostdeutschen Bundesländern profitieren, nicht nur zukünftige Rentnerinnen und Rentner, sondern auch diejenigen, die schon in Rente sind und durch die Rentenüberleitung nicht den angemessenen Lohn für ihre Lebensleistung bekommen.","","","42",50,19099
"44",44,"Bei der Ausgestaltung der Grundrente müssen wir versuchen, möglichst viele Menschen einzubeziehen, die aufgrund ihrer Ostbiografie, zum Beispiel durch sehr niedrige Löhne, trotz langer Vollzeitbeschäftigung in der Grundsicherung gelandet sind.","","","43",50,19099
"45",45," Ich bin da guter Dinge, dass das auch gelingt.","","","44",50,19099
"46",46," Der Arbeits- und Sozialminister wird demnächst ein Maßnahmenpaket vorstellen mit dem Kern der Grundrente, ergänzt um Freibeträge in der Grundsicherung und eine Reform des Wohngelds.","","","45",50,19099
"47",47," Das ist ein Paket, das nicht nur, aber gerade auch in den ostdeutschen Bundesländern wirken wird.","","","46",50,19099
"48",48,"Herzlichen Dank für Ihre Aufmerksamkeit.","","","47",50,19099
"49",49," Vizeprasident Dr.
 Hans-Peter ","","","48",50,19099
