"","X","V1","Argumentativ","Claim_Premise","Satz_Nr","Rede_Nr","Sitzungsnummer"
"1",1,"","","","00",92,19122
"2",2," Jens Koeppen, CDU/CSU, hat jetzt das Wort.","","","01",92,19122
"3",3," Jens Koeppen:","","","02",92,19122
"4",4,"Herr Präsident! Liebe Kolleginnen und Kollegen! Wir mussten ja lange auf den Antrag warten.","","","03",92,19122
"5",5," Seit 2012 ist erin jeder Legislaturperiode jedes Jahr regelmäßig dabei.","","","04",92,19122
"6",6," Allerdings ist er nicht besser geworden.","","","05",92,19122
"7",7," Sie haben die gleichen alten Argumente, die nachweislich — ich werde Sie darauf noch hinweisen — falsch sind.","","","06",92,19122
"8",8," Allerdings hat sich eins geändert, zumindest bei Ihnen von den Grünen, bei Ihnen von den Linken noch nicht.","","","07",92,19122
"9",9," Sie haben früher davon gesprochen, Stromsperren gesetzlich zu verbieten.","","","08",92,19122
"10",10," Jetzt reden Sie wenigstens davon, dass Stromsperren zu verhindern sind.","","","09",92,19122
"11",11," Das ist ja schon mal was, wo man zueinanderkommen kann.","","","10",92,19122
"12",12," Man kann darüber reden, wie man das macht, wie man Stromsperren verhindert.","","","11",92,19122
"13",13,"Es ist natürlich ein ernstzunehmendes Thema.","","","12",92,19122
"14",14," Aber in Deutschland gibt es doch bereits ganz strenge und klare Regeln bei Stromsperren, und zwar, ob, wann und für wen der Energieerzeuger Stromsperren überhaupt verhängen darf.","","","13",92,19122
"15",15," Das ist ganz klar geregelt.","","","14",92,19122
"16",16," Es gibt Schuldnerberatungen.","","","15",92,19122
"17",17," Die Sozialämter erteilen Auskunft, geben Hilfe, wenn eine Stromsperre droht oder bereits verhängt ist.","","","16",92,19122
"18",18," Es gibt ein gutes Netz von Ansprechpartnern.","","","17",92,19122
"19",19," Es gibt Hilfe für die betroffenen Menschen bei der Kommunikation mit dem Stromanbieter.","","","18",92,19122
"20",20," — Sie können sich doch gerne melden und eine Zwischenfrage stellen.","","","19",92,19122
"21",21," — Ja, genau.","","","20",92,19122
"22",22,"In $ 19 Absatz 2 der S grund d nung ist generell seregelt,d dass der Kunde mit mindestens 100 Euro im Rückstand sein muss, bevor der Energieversorger tiberhaupt aktiv werden darf.","","","21",92,19122
"23",23," In den meisten Fallen darf der Energieversorger überhaupt keine Sperre verhängen, und zwar, wenn im Haushalt eine schwangere Frau wohnt, wenn im Haushalt Kinder leben, wenn im Haushalt alte oder behinderte Menschen leben.","","","22",92,19122
"24",24,"Wenn all diese Kriterien nicht vorliegen, muss die Sperre außerdem vier Wochen vorher angekündigt werden.","","","23",92,19122
"25",25," Daher sind sowohl Ihre Ausführungen und Ihr Gekrähe falsch, weil wir hier eine ganz klare Rechtslage haben.","","","24",92,19122
"26",26,"Was ist außerdem in Ihrem Antrag inhaltlich falsch? Beide Anträge reden davon, dass es eine wachsende Anzahl von Sperren gibt.","","","25",92,19122
"27",27," Richtig ist:","","","26",92,19122
"28",28," Wir haben eine Abnahme der Zahl von Stromsperren.","","","27",92,19122
"29",29," Das stand ganz klar in der Antwort auf die Kleine Anfrage, die Sie an die Bundesregierung gestellt haben.","","","28",92,19122
"30",30," Wir haben eine Tendenz zu weniger Stromsperren.","","","29",92,19122
"31",31," Ich weiß gar nicht, was Sie da erzählen.","","","30",92,19122
"32",32," Lesen Sie doch einfach mal Ihre eigenen Anfragen.","","","31",92,19122
"33",33," — Sie könnten sie übrigens auch lesen.","","","32",92,19122
"34",34,"Hinzu kommt, dass bei der Grundsicherung im Regelsatz ein Betrag — er wird ständig dynamisiert — zur Deckung der Energiekosten enthalten ist.","","","33",92,19122
"35",35," Mittlerweile liegt er bei 36 Euro.","","","34",92,19122
"36",36," Verschiedene Studien und Portale haben gesagt, in solchen Fällen greift bei 39 Euro dieser Energiesatz.","","","35",92,19122
"37",37," Also reden Sie nicht davon, dass nichts gemacht wird.","","","36",92,19122
"38",38," Es gibt noch zu viele Betroffene; aber es liegt nicht an den Regelungen, sondern das Problem liegt möglicherweise — lassen Sie uns mal schauen, wie man das verbessern kann — an der Kommunikation, an der Anwendung der Regelungen, an der Transparenz und möglicherweise daran, wie man die Regeln, die es gibt, vermittelt.","","","37",92,19122
"39",39," Es fehlt aber nicht — und das ist ganz klar — an den Schutzinstrumenten.","","","38",92,19122
"40",40," Die Statistik ist eindeutig.","","","39",92,19122
"41",41,"Die Hälfte aller Stromsperren betrifft Haushalte innerhalb der Grundsicherung; das ist richtig.","","","40",92,19122
"42",42," Aber die Gründe der Stromsperren lassen sich nicht auf, wie Sie es schreiben, Energie- oder Einkommensarmut reduzieren.","","","41",92,19122
"43",43," Vielmehr liegt das Problem vielleicht darin, dass es plötzliche Veränderungen im Leben bzw.","","","42",92,19122
"44",44," im Lebensumfeld dieser Menschen gibt, etwa eingeschränkte Finanzund Planungsfähigkeiten.","","","43",92,19122
"45",45," Darüber, meine Damen und Herren, kann man doch aber reden, anstatt das Problem so zu verteufeln, wie Sie das machen.","","","44",92,19122
"46",46,"— Ich habe Ihnen doch gerade — ich weiß nicht, ob Sie überhaupt zugehört habendie Maßnahmen, die jetzt gesetzlich geregelt sind, alle vorgetragen.","","","45",92,19122
"47",47," Ich fange doch nicht noch mal von vorne an.","","","46",92,19122
"48",48,"Dann müssen Sie auch zu spater Stunde, auch wenn es der letzte Antrag ist, mal zuhören, Herrgott noch mal! Das ist doch nicht so schwer.","","","47",92,19122
"49",49," Das müssen doch alle machen.","","","48",92,19122
"50",50," Es müssen alle zuhören, und das verlange ich auch von Ihnen.","","","49",92,19122
"51",51," Wenn Sie einen Antrag einbringen, müssen Sie vor allen Dingen auch mal zuhören, was man Ihnen sagt, damit Sie nicht nächstes Jahr wieder mit der ollen Kamelle kommen.","","","50",92,19122
"52",52," Lassen Sie uns darüber reden, wie wir es besser machen, wie wir die Kommunikation aufbauen, damit so etwas nicht passiert.","","","51",92,19122
"53",53," Studien haben auch ergeben, dass ein Teil der Stromsperren — auch darüber müssen wir reden auf das bewusste Ausnutzen der Grundversorgungspflichten zurückzuführen ist.","","","52",92,19122
"54",54," Deswegen ist für mich klar:","","","53",92,19122
"55",55," Ein Verbot von Stromsperren ist ein Fehlanreiz, und zwar zulasten der Energieversorgung und letztlich zulasten der Allgemeinheit; denn diejenigen, die sagen:","","","54",92,19122
"56",56," „Ich bezahle die Stromrechnung nicht, weil ich es einfach nicht kann oder nicht will“, tun das aufgrund eines Fehlanreizes, und das müssen wir verhindern, liebe Kolleginnen und Kollegen von Grünen und Linken.","","","55",92,19122
"57",57," Abschließend noch ein Wort zu den Energiepreisen.","","","56",92,19122
"58",58," Trotz steigender Strompreise — und ein Grund dafür sind ja auch unsere Maßnahmen bei Energieversorgung und Energiewende - ist die Anzahl der Stromsperren zurückgegangen.","","","57",92,19122
"59",59," Der Staat hat aber auch die Zuständigkeit, dafür zu sorgen, dass Energie kein Luxusgut wird.","","","58",92,19122
"60",60," Deswegen müssen wir bei allen Maßnahmen, die wir bei der Energiewende, bei der Energieversorgung ergreifen, im Zieldreieck bleiben.","","","59",92,19122
"61",61," Ich bleibe dabei, dass das Zieldreieck für uns alle sein sollte:","","","60",92,19122
"62",62," Versorgungssicherheit, natürlich Umweltverträglichkeit, aber auch Bezahlbarkeit, damit so etwas nicht passiert.","","","61",92,19122
"63",63,"Vielen Dank und schönes Wochenende!Jens KoeppenPräsident Dr.
 Wolfgang ","","","62",92,19122
