"","X","V1","Argumentativ","Claim_Premise","Satz_Nr","Rede_Nr","Sitzungsnummer"
"1",1,"","","","00",62,19083
"2",2,"Vielen Dank, Matthias W.","","","01",62,19083
"3",3," Birkwald.","","","02",62,19083
"4",4," — Bevor ich Herrn Straubinger das Wort erteile, möchte ich den schon zitierten Volker Beck hier bei uns im Haus herzlich begrüßen.","","","03",62,19083
"5",5," Jetzt hat der Kollege Max Straubinger für die CDU/ CSU-Fraktion das Wort.","","","04",62,19083
"6",6," Max Straubinger:","","","05",62,19083
"7",7,"Frau Präsidentin! Werte Kolleginnen und Kollegen! Wir behandeln heute den Antrag von FDP, Linken und Bündnis 90/Die Grünen — eine seltsame politische Formation, die wir hier erleben müssen.","","","06",62,19083
"8",8," — Ja, das ist völlig ungewohnt.","","","07",62,19083
"9",9," — Aber es geht um ein Ziel, das wir auch verstehen.","","","08",62,19083
"10",10," Die jüdischen Kontingentflüchtlinge sollen gemäß Ihrem Antrag hinsichtlich ihrer Alterssicherung in irgendeiner Form des Sozialrechts bessergestellt werden.","","","09",62,19083
"11",11," Es ist auch großartig, wenn mit einem Antrag aufgezeigt wird, wie die Zielstellung erreicht werden kann, dies jedoch letztendlich zwischen den Fraktionen nicht mehr kompatibel ist, sondern nur noch mehrere Möglichkeiten aufgeworfen werden.","","","10",62,19083
"12",12," Herr Kollege Birkwald hat gerade dargestellt, dass Linke und Grüne eine Fremdrentenrechtspräferenz haben und die FDP eine mögliche Fondslösung anstrebt.","","","11",62,19083
"13",13," Von daher zeigt sich:","","","12",62,19083
"14",14," Wir haben möglicherweise ein gleiches Ziel, aber gleichzeitig die Schwierigkeit, uns für die am besten geeigneten Maßnahmen zu entscheiden.","","","13",62,19083
"15",15,"Ich möchte darlegen, dass man anhand des Antrags sieht, dass das Thema sehr komplex ist und nicht nur einseitig von den Betroffenen her gesehen werden kann; denn hier ist die Gesamtheit aller in der Rentenversicherung Versicherten sowie aller, die einer sozialen Unterstützung bedürfen, mit zu betrachten.","","","14",62,19083
"16",16," Dazu gehören auch viele weitere Gruppierungen, die möglicherweise betroffen sind.","","","15",62,19083
"17",17," Das zeigt sehr deutlich, wie schwierig die Aufgabe des Findens einer möglichen Lösung ist.","","","16",62,19083
"18",18," Wenn es um das Rentenrecht geht, muss man den Grundgesetzartikel 3 besonders betrachten.","","","17",62,19083
"19",19," Dort heißt es:","","","18",62,19083
"20",20," Wesentlich Gleiches ist gleich zu behandeln, und wesentlich Ungleiches ist ungleich zu behandeln.","","","19",62,19083
"21",21," — So haben wir im Koalitionsvertrag niedergelegt — das steht auch hier im Antrag -, bei schwierigen Fällen in der Grundsicherung im Rentenüberleitungsprozess eine Unterstützung durch eine Fondslösung zu prüfen.","","","20",62,19083
"22",22," Das ist das, was wir in der Koalition vereinbart haben.","","","21",62,19083
"23",23," Warum haben wir dies so vereinbart? Aber zuerst möchte ich darlegen, dass Deutschland in einer großartigen humanitären Leistung und humanitären Geste 215 000 Personen aus den Nachfolgestaaten der Sowjetunion, aber auch aus Russland aufgenommen hat, zu Recht aufgenommen hat, weil sie in ihren Herkunftsländern entweder Diskriminierungen ausgesetzt waren oder Antisemitismus, der in diesen Ländern herrscht, erleiden mussten.","","","22",62,19083
"24",24," Dem haben wir uns in unserer Verantwortung vor der Geschichte und in unserer Verantwortung vor der Shoah auch gestellt.","","","23",62,19083
"25",25," Daher haben wir diese Personen zu Recht aufgenommen.","","","24",62,19083
"26",26," Das zeigt sehr deutlich, dass wir ein humanitärer Staat sind und uns einer Lösung der damit verbundenen Probleme nicht verschließen.","","","25",62,19083
"27",27,"Das gilt aber auch für andere Personen.","","","26",62,19083
"28",28," Das gilt für syrische Kriegsflüchtlinge genauso wie für ehemalige Bootsflüchtlinge aus Vietnam.","","","27",62,19083
"29",29," Das gilt genauso für chemalige Botschaftsflüchtlinge aus Albanien, die ebenfalls unter dem Gesichtspunkt der Humanität in Deutschland Aufnahme gefunden haben.","","","28",62,19083
"30",30," Das ist meines Erachtens schon ein sehr entscheidendes Moment, das in der Diskussion auch betrachtet werden muss.","","","29",62,19083
"31",31," Jetzt wird von den Antragstellern angeführt, dass das Angewiesen-Sein auf die Grundsicherung entwürdigend und den Menschen vor allen Dingen nicht zumutbar sei.","","","30",62,19083
"32",32," Ich kann mich noch daran erinnern, wie die Grundsicherung unter Rot-Grün eingeführt wurde.","","","31",62,19083
"33",33," Dort hieß es:","","","32",62,19083
"34",34," Wir kehren ab von der Sozialhilfe, um im Wesentlichen mit ein bisschen Unterstützung den Lebensunterhalt bestreiten zu können.","","","33",62,19083
"35",35," Mit der Grundsicherung sollte Teilhabe an einem menschenwürdigen Leben in Deutschland erreicht werden, zwar nicht üppig, aber menschenwürdig.","","","34",62,19083
"36",36," — Das ist meines Erachtens der entscheidende Gesichtspunkt.","","","35",62,19083
"37",37," Daher soll man diese Grundsicherungsleistung, die mittlerweile 1 Million Menschen aufgrund des Alters oderMax Straubingeraufgrund der Erwerbsunfähigkeit in Anspruch nehmen, nicht so herabwürdigen.","","","36",62,19083
"38",38," Das ist eine große soziale Leistung für die Menschen, die wir hier leisten.","","","37",62,19083
"39",39," Dann der Vorschlag, das Fremdrentengesetz hier mit anzuwenden.","","","38",62,19083
"40",40," Es ist bezeichnend, dass der Kollege Birkwald zwar Präferenz dafür gezeigt, aber dann trotzdem aufgezeigt hat, dass er dies ob der Kürzung der Anerkennung der Arbeitsleistungen im Herkunftsland auf 60 Prozent, die wir im F Irentengeset g haben, für nicht ausreichend hält.","","","39",62,19083
"41",41," Ich frage mich schon, was Ihr Vorschlag soll.","","","40",62,19083
"42",42," Es ist natürlich richtig, dass Leistungen nach dem Fremdrentengesetz mittlerweile zum Teil auch über Grundsicherungsleistungen aufgestockt werden müssen, weil in einzelnen Bereichen die Rente nicht reicht, insbesondere wenn man in München, Düsseldorf oder Hamburg wohnt.","","","41",62,19083
"43",43," Auch das zeigt die Unvollkommenheit dieser Lösung.","","","42",62,19083
"44",44," Es ist ferner festzustellen, dass das Fremdrentenrecht für deutsche Volkszugehörige die Grundlage ist, die infolge der Nachkriegssituation in Russland und den Nachfolgestaaten der Sowjetunion Diskriminierungen ausgesetzt waren und zur Ausreise genötigt wurden oder ausreisen mussten.","","","43",62,19083
"45",45," Das ist die Anerkenntnis für die Deutschen, das steht auch hier im Gesetz.","","","44",62,19083
"46",46," Es hat jeder, der zu uns kommt, die Möglichkeit, prüfen zu lassen, ob er dem deutschen Fremdrentenrecht unterliegt.","","","45",62,19083
"47",47," Das ist jedem möglich.","","","46",62,19083
"48",48," Für jüdische Zuwanderer gilt zusätzlich:","","","47",62,19083
"49",49," Wenn sie einer NS-Verfolgung ausgesetzt waren, dann gibt es zusätzliche Entschädigungsleistungen, die nicht auf die Grundsicherung angerechnet werden.","","","48",62,19083
"50",50," Also, wir haben hier entsprechende Instrumente.","","","49",62,19083
"51",51," Gleichwohl werden wir den vorliegenden Antrag in der parlamentarischen Beratung einer Prüfung unterziehen und bewerten.","","","50",62,19083
"52",52,"In diesem Sinne:","","","51",62,19083
"53",53," Herzlichen Dank für die Aufmerksamkeit.
 Vizepräsidentin Claudia ","","","52",62,19083
