"","X","V1","Argumentativ","Claim_Premise","Satz_Nr","Rede_Nr","Sitzungsnummer"
"1",1,"","","","00",183,19121
"2",2,"Vielen Dank, Frau Kollegin von Storch.","","","01",183,19121
"3",3," — Als nächster Redner hat der Kollege Helge Lindh, SPD-Fraktion, das Wort.","","","02",183,19121
"4",4," Helge Lindh:","","","03",183,19121
"5",5,"Herr Präsident! Liebe Kolleginnen und Kollegen! Ich würde eine andere Gegenrechnung aufmachen, Frau von Storch:","","","04",183,19121
"6",6," Was würde diesem Staat finanziell erspart bleiben,wenn wir nicht Ihre Partei finanzieren müssten, Ich bin stolz darauf, dass diese Koalition sowohl für Beamtinnen und Beamte viel macht als sich auch für Gendergerechtigkeit, für Frauen, für Verfolgte und für Opfer von Vergewaltigungen einsetzt.","","","05",183,19121
"7",7," Das ist das Zeichen eines selbstbewussten Rechtsstaates, und es ist gut, dass es so ist.","","","06",183,19121
"8",8," Eigentlich müsste dieses Gesetz „Attraktiverer-öffentlicher-Dienst-Gesetz“ oder „Glücklichere-Beamte-Gesetz“ heißen.","","","07",183,19121
"9",9," Jetzt hört man gleich — im Ausschuss war es auch so — das Schreien.","","","08",183,19121
"10",10," Ich werde aber versuchen, es Ihnen sehr schlüssig zu begründen, und ich versuche, im Zuge dessen auch zu begründen, warum dieses scheinbar so nüchterne Gesetz auch ziemlich viel mit dem zu tun hat, was wir gestern im Rahmen von Meinungsfreiheit und Wahrung der Demokratie diskutiert haben.","","","09",183,19121
"11",11," Denn wenn man es mal martialisch ausdrückt, dann sind die Bundespolizistinnen und Bundespolizisten, die Zollbeamtinnen und Zollbeamten, die Mitarbeiter von Ministerien und die Bundeswehrsoldatinnen und Bundeswehrsoldaten gerade diejenigen, die tagtäglich für diesen demokratischen Rechtsstaat einstehen, ihren Kopf hinhalten und manchmal ihr Leben riskieren.","","","10",183,19121
"12",12," Sie verdienen von uns auf jeden Fall nicht nur schöne Worte, sondern wahrlich Anerkennung.","","","11",183,19121
"13",13," Sie verdienen das in aller Deutlichkeit.","","","12",183,19121
"14",14," Und genau so handeln wir:","","","13",183,19121
"15",15," Sie verdienen das durch Prämien und dadurch, dass Zulagen endlich signifikant erhöht werden.","","","14",183,19121
"16",16,"Man könnte jetzt — das wäre das Übliche — erwidern:","","","15",183,19121
"17",17," Ja, aber was ist mit der Ruhegehaltsfähigkeit, der pauschalen Beihilfe, den durch $ 55 BeamtVG betroffenen Grenzschützern, dem Familienzuschlag? Es ist nämlich üblich, dass wir uns daran gewöhnt haben, alles aufzuzählen, was wir noch nicht oder bewusst nicht beschlossen haben, anstatt mal zu betonen — Johannes Rau hat es uns empfohlen, und wir sollten uns daran erinnern -, was alles gelungen ist.","","","16",183,19121
"18",18," Dies ist ein verdammt gutes Gesetz, ein sehr sinnvolles, kluges Gesetz und ein kluger Kompromiss, auf den wir stolz sein können.","","","17",183,19121
"19",19," Ich finde, es ist auch gar nicht beschämend, das zu sagen.","","","18",183,19121
"20",20," Wir müssen jetzt nicht hurrapatriotisch feiern und es das beste Gesetz aller Zeiten nennen; diese Rituale braucht kein Mensch mehr.","","","19",183,19121
"21",21," Aber genauso wenig müssen wir uns davon distanzieren oder immer betonen, was nicht gelungen ist.","","","20",183,19121
"22",22," Ich weiß, wovon ich rede:","","","21",183,19121
"23",23," Wir haben in meiner eigenen Partei durchaus die Tradition, immer hervorzuheben, was nicht geschafft ist.","","","22",183,19121
"24",24,"Heute Morgen hat Herr Michelbach in Form eines negativen Bekenntnisses in der Frage des Solidaritätszuschlages auch so etwas geliefert.","","","23",183,19121
"25",25," Ich denke, wir brauchen das nicht.","","","24",183,19121
"26",26," Wir können den Kompromiss sehr selbstbewusst vertreten.","","","25",183,19121
"27",27," Das fällt aber schwer in Zeiten, in denen gerade zum Beispiel von der AfD unser sehr handlungsfähiger Staat als unfähig, langsam und alles behindernd dargestellt wird.","","","26",183,19121
"28",28,"Helge LindhUnd es fallt schwer in Zeiten, in denen Thomas de Maiziere leider sehr unsouverän daran gehindert wird, zu reden.","","","27",183,19121
"29",29," Es fällt auch schwer in Zeiten, in denen es als pseudointellektuell dargestellt wird — ich habe jüngst diese Erfahrung gemacht -, wenn man Sachverhalte mit fünf längeren Sätzen darlegen will und auch noch drei Fremdwörter gebraucht.","","","28",183,19121
"30",30," Aber ich bin der Meinung:","","","29",183,19121
"31",31," lieber pseudointellektuell als echt dumm.","","","30",183,19121
"32",32," Deshalb stehen wir mit Selbstbewusstsein zu diesem Gesetz.","","","31",183,19121
"33",33," Es wurde schon erwähnt:","","","32",183,19121
"34",34," 40 Prozent Erhöhung der Polizeizulage, bei der BKA-Zulage sind es 50 Prozent.","","","33",183,19121
"35",35," Wir versuchen jetzt, bewusst Prämien einzuführen, die flexibler gestaltet sind, um darauf zu reagieren, dass es jetzt keine paradiesischen Verhältnisse mehr im öffentlichen Dienst gibt, sondern eine große Konkurrenz durch Wettbewerber auf dem privaten Markt oder im IT-Bereich.","","","34",183,19121
"36",36,"Da reicht es nicht, einfach festzuhalten, dass es ja ein ganz gutes Ruhegehalt gibt, sondern der Auftrag ist, uns darum zu kümmern, dass der Dienst selbst attraktiv ist und dass der Dienstherr die Möglichkeiten hat, das beweglich zu gestalten.","","","35",183,19121
"37",37," Ich bin der Meinung:","","","36",183,19121
"38",38," Das ist dank der Mitarbeiterinnen und Mitarbeiter des Ministeriums, die das in mühsamer Arbeit entwickelt haben, gelungen.","","","37",183,19121
"39",39," Auch den Mitarbeiterinnen und Mitarbeitern der Fraktionen, die die Verbesserungen für uns mitentwickelt haben — das machen nicht allein wir Abgeordneten —, gebührt Dank, dass wir heute ein so gutes Gesetzespaket auf den Weg bringen.","","","38",183,19121
"40",40," Im Rahmen dessen möchte ich auch auf die Kritikpunkte eingehen; denn ich finde, das gehört zu einer souveränen Demokratie.","","","39",183,19121
"41",41," Der Familienzuschlag wurde erwähnt.","","","40",183,19121
"42",42," Bewusst haben wir nicht nur im Rahmen der Beschlussempfehlung, sondern auch in Form eines Antrages eindeutig festgehalten, dass wir den Familienzuschlag mit einem Schwerpunkt auf der Situation von Familien mit Kindern wieder aufgreifen werden.","","","41",183,19121
"43",43," In diesem Rahmen wird es sicher auch sinnvoll sein, sich noch einmal die Versorgungslücke bei Geschiedenen - das betrifft gerade geschiedene Frauen — und bei Polizistinnen und Polizisten in Teilzeit anzugucken.","","","42",183,19121
"44",44,"Wir haben uns ganz bewusst gemeinsam entschieden — denn wir sind in einer Koalition, und dieser Gesetzentwurf ist ein Kompromiss -, dass wir keine Verbesserung bei den ehemaligen DDR-Grenzschützern und Stasimitarbeitern wollen; denn es gibt einen Generalkompromiss aus den 90er-Jahren.","","","43",183,19121
"45",45," Aus Respekt vor den SED-Opfern haben wir letztlich diese Entscheidung gemeinsam getroffen, und wir stehen auch zu dieser Entscheidung.","","","44",183,19121
"46",46,"Wir Sozialdemokraten sind immer noch überzeugt, dass die pauschale Beihilfe eine kluge Idee und beihilferechtlich vernünftig ist und dass auch nicht, wie Sie es sehen, die Gefahr besteht, dass wir in die Bürgerversicherung geraten.
Vizepräsident Wolfgang ","","","45",183,19121
